{
  "test_id": "MULTI_001",
  "name": "Simple Math",
  "category": "basic",
  "type": "single-turn",
  "complexity": "low",
  "can_parallelize": true,
  "description": "Basic math test to verify system responds correctly to simple arithmetic questions without using tools",
  "request": {
    "model": "gpt-4.1-nano",
    "messages": [
      {
        "role": "user",
        "content": "What is 2+2?"
      }
    ],
    "stream": true,
    "user_id": 10001
  },
  "validation": {
    "no_tools": true,
    "response_not_empty": true,
    "response_contains": ["4", "four"]
  },
  "metadata": {
    "source_file": "test/core/test_comprehensive_detailed.py",
    "source_line": 217,
    "created_date": "2025-08-03T00:00:00Z",
    "tags": ["basic", "math", "no-tools"],
    "notes": "Basic sanity check for the system"
  }
}