{
  "test_id": "MULTI_002",
  "name": "General Knowledge",
  "category": "basic",
  "type": "single-turn",
  "complexity": "low",
  "can_parallelize": true,
  "description": "Test general knowledge retrieval without requiring external tools",
  "request": {
    "model": "gpt-4.1-nano",
    "messages": [
      {
        "role": "user",
        "content": "What is the capital of France?"
      }
    ],
    "stream": true,
    "user_id": 10001
  },
  "validation": {
    "no_tools": true,
    "response_contains": ["Paris"]
  },
  "metadata": {
    "source_file": "test/core/test_comprehensive_detailed.py",
    "source_line": 230,
    "created_date": "2025-08-03T00:00:00Z",
    "tags": ["basic", "knowledge", "no-tools"],
    "notes": "Verifies basic knowledge without tool usage"
  }
}