{
  "test_id": "MULTI_009",
  "name": "Web Search - News",
  "category": "web_search",
  "type": "single-turn",
  "complexity": "medium",
  "can_parallelize": true,
  "description": "Test web search for general news and current information",
  "request": {
    "model": "gpt-4.1-nano",
    "messages": [
      {
        "role": "user",
        "content": "Search the web for latest AI news"
      }
    ],
    "stream": true,
    "enable_citations": true,
    "user_id": 10001
  },
  "validation": {
    "expected_tools": ["web_search_call"],
    "response_not_empty": true
  },
  "metadata": {
    "source_file": "test/core/test_comprehensive_detailed.py",
    "source_line": 338,
    "created_date": "2025-08-03T00:00:00Z",
    "tags": ["web_search", "news", "AI"],
    "notes": "Tests general web search for news content"
  }
}