{
  "test_id": "MULTI_007",
  "name": "File Attachment - Question about PDF",
  "category": "file_attachment",
  "type": "single-turn",
  "complexity": "medium",
  "can_parallelize": true,
  "description": "Test specific question answering about PDF content",
  "request": {
    "model": "gpt-4.1-nano",
    "messages": [
      {
        "role": "user",
        "content": "What is the main contribution of this paper?"
      }
    ],
    "attachments": ["https://arxiv.org/pdf/2505.18499.pdf"],
    "stream": true,
    "enable_citations": true,
    "user_id": 10001
  },
  "validation": {
    "expected_tools": ["file_search_call"],
    "response_not_empty": true
  },
  "metadata": {
    "source_file": "test/core/test_comprehensive_detailed.py",
    "source_line": 306,
    "created_date": "2025-08-03T00:00:00Z",
    "tags": ["file_attachment", "PDF", "question_answering"],
    "notes": "Tests specific question answering about PDF content"
  }
}