{
  "test_id": "MULTI_004",
  "name": "Context Search - Note by ID",
  "category": "context_search",
  "type": "single-turn",
  "complexity": "medium",
  "can_parallelize": true,
  "description": "Test context search for specific note by ID",
  "request": {
    "model": "gpt-4.1-nano",
    "messages": [
      {
        "role": "user",
        "content": "Show me the content of note 10001"
      }
    ],
    "stream": true,
    "enable_citations": true,
    "user_id": 10001
  },
  "validation": {
    "expected_tools": ["context_search_call"],
    "response_not_empty": true
  },
  "metadata": {
    "source_file": "test/core/test_comprehensive_detailed.py",
    "source_line": 260,
    "created_date": "2025-08-03T00:00:00Z",
    "tags": ["context_search", "note_id", "specific_query"],
    "notes": "Tests note retrieval by specific ID"
  }
}